{
  "schema_version": 1,
  "notification_id": "replace-with-a-unique-id",
  "destination": {
    "kind": "target",
    "name": "owner"
  },
  "message": {
    "title": "Task complete",
    "body": "The requested work has finished.",
    "format": "plain",
    "priority": "normal"
  },
  "policy": {
    "mode": "single"
  }
}
